<?xml version="1.0" encoding="Cp1252"?>
<!DOCTYPE veg_plot SYSTEM "file:C:\plot_database\veg_plot_dtd.dtd">
<veg_plot preferred="true">
<plot_id>4444444</plot_id>
	<PI>
		<pid>this is the id number of the pi</pid>
		<pid_metadata>
			<institution>null</institution>
			<address>null</address>
			<phone>null</phone>
			<email>null</email>
		</pid_metadata>
	</PI>
	<contact>
	<contact_pid>this is the id number of the contact person</contact_pid>
		<contact_pid_metadata>
			<contact_institution>null</contact_institution>
			<contact_address>null</contact_address>
			<contact_phone>null</contact_phone>
			<contact_email>null</contact_email>
		</contact_pid_metadata>

	</contact>
	<class_association>pomaguliad bush</class_association>
	<class_alliance>goatsum</class_alliance>
	<clasification_quality>high</clasification_quality>
	<author_plot_number>personal reference</author_plot_number>
	<previous_plot_number>old name or number</previous_plot_number>
	<previous_plot_record>previous plot number</previous_plot_record>
	<author>worker who described the plot</author>
	<date>date of vegetation plot</date>
	<ownership>who owns the land</ownership>
	<media>any photographs, maps and/or other media</media>
	<effort_level>effort spent bulding the plot</effort_level>
	<disturbance_history>the land disturbance history</disturbance_history>

</veg_plot>
